,company,job_header,job_description
16,CPP Investments,"Intern Analyst, Credit Strategy","Company Description

Make an impact at a global and dynamic investment organization
When you invest your career in CPP Investments, you join one of the most respected and fastest growing institutional investors in the world. With current assets under management valued in excess of $500 billion, CPP Investments is a professional investment management organization that globally invests the funds of the Canada Pension Plan (CPP) to help ensure long-term sustainability. The CPP Fund is projected to reach $3 trillion by 2050. CPP Investments invests in all major asset classes, including public equity, private equity, real estate, infrastructure and fixed-income instruments, and is headquartered in Toronto with offices in Hong Kong, London, Luxembourg, Mumbai, New York City, San Francisco, São Paulo and Sydney.
CPP Investments attracts and selects high-potential individuals from top-tier institutions around the globe. Join our team and look forward to:
Diverse and inspiring colleagues and approachable leaders
Stimulating work in a fast-paced, intellectually challenging environment
Accelerated exposure and responsibility
Global career development opportunities
Being motivated every day by CPP Investments’ important social purpose and unshakable principles
A deeply rooted culture of Integrity, Partnership and High Performance
If you share a passion for performance, value a collegial and collaborative culture, and approach everything with the highest integrity, here’s an opportunity for you to invest your career at CPP Investments.

Job Description

The Credit Strategy Group is part of the Credit Investments (CI) department at CPP Investments. CI manages $38 billion of assets and is responsible for all of CPP Investments public and private credit investments globally. CI provides debt financing solutions across the entire credit structure, including term loans, high-yield bonds, mezzanine lending, structured products and other solutions for borrowers in all sectors. The Credit Strategy group within CI seeks to enhance the risk-adjusted returns of the CI portfolio through portfolio construction techniques that enable the CI portfolio to deliver the total fund’s desired credit exposure as well as maximize alpha generation across relative value factors such as sector, geography, rating, etc.
We are currently recruiting for an intern analyst in the Credit Strategy Group, for a four-month internship from January to April 2022. Candidates in an undergraduate program that will be graduating in December 2022 or later are eligible to apply.
Credit Strategy Position Description
Primary Responsibilities:
Assist in the build-out of the portfolio strategy function of the recently created Credit Investments department at CPP Investments
Develop proprietary portfolio construction and monitoring tools to enhance management of the CI portfolio
Assist in the development of a relative value framework within CI to improve the effectiveness with which CI delivers a global portfolio
Other Responsibilities:
Analyzing specific investment opportunities as it relates to fit within the overall CI portfolio
Partner with other departments at CPP Investments (e.g. Total Fund Management, Finance, Analytics and Risk and Capital Markets and Factor Investing) to advance initiatives such as enhanced integration of bottom-up and top-down decision making, improved reporting and incorporation of capital markets inputs into the evaluation of prospective investment opportunities

Qualifications

Position Requirements:
The ideal candidate will be graduating from an undergraduate program in December 2022 (or later) and is working towards a degree in math, engineering, business or computer science.
Experience with programming languages (such as C++/Java, R, VBA, Matlab or Python).
Excellent written and verbal communication skills and an interest in working in a dynamic collaborative environment.
Interest in finance/investment management.
Ability to prioritize work and manage multiple responsibilities simultaneously.
Excellent academic performance.
Knowledge in managing databases (such as MySQL, SQL Server or Oracle) would be a plus.
Candidates must exemplify CPP Investments’ guiding principles of high performance, integrity and partnership.

Additional Information

If you have an interest in working with talented professionals in the financial industry in an environment of integrity, partnership and high performance then you should consider a career in Credit Investments at CPP Investments.
To apply, please include a cover letter, resume and transcripts (full unofficial version) by September 21, 2021 at 9:00 AM EST.
Visit our Linkedin Career Page or Follow us on LinkedIn.
At CPP Investments, we are committed to diversity and equitable access to employment opportunities based on ability. If you require any accommodation for the recruitment/interview process, please let us know and we will work with you to meet your needs.
We thank all applicants for their interest but will only contact candidates selected to advance in the hiring process.
Disclaimer:
CPP Investments does not accept resumes from employment placement agencies, head-hunters or recruitment suppliers that are not in a formal contractual arrangement with us. Our recruitment supplier arrangements are restricted to specific hiring needs and do not include this or other web-site job postings. Any resume or other information received from a supplier not approved by CPP Investments to provide resumes to this posting or website will be considered unsolicited and will not be considered. CPP Investments will not pay any referral, placement or other fee for the supply of such unsolicited resumes or information."
17,TD Bank,Data Science & Advanced Analytics Intern/Co-op,"All companies are not the same. What makes TD special as a business is also, what makes us special as an employer. Why TD?

TD's Colleague Promise: A better you. A better us.

A more confident you means a stronger us. We empower you to grow your skills, gain new perspectives, and create impact at work and in your community. That’s our unique and inclusive culture.
Department Overview
Co-op and Internship opportunities allow you to gain valuable work experience across a number of the businesses at TD. You will work with experienced colleagues, receive world class training, and be part of a community of students across TD, where you will have an impact, grow as individual and experience our culture of care.
Our Momentum Program, is offered with select Co-op and Internship roles, and is designed to help you better understand the TD business, build on critical career capabilities, and broaden your professional network. This program is designed to complement your on-the job experience and features:
Leadership talks with key Leaders from across the organization
Lunch and Learns on topics such as Innovation
Diversity and Inclusion and Personal Branding and so much more
Job Description
The Data Science & Advanced Analytics Co-op/Intern is a 4-month work term (potential to extend to 8 months) opportunity in analytics and data. The Data Science and Advanced Analytics Co-op/Intern will perform a variety of activities, which may include:
Apply machine learning methods to conduct data-driven research, identify opportunities, and make tangible recommendations to senior management.
Support business partners to identify opportunities for process optimization and informed decision-making, and build innovative solutions.
Work with structured and unstructured data and prepare data sets for machine learning through integration, cleaning, feature engineering, scaling and transforming data
Build production-scale solutions and work with deployment teams to integrate in business operations
Leverage visualization methods to represent results and communicate outcomes to technical and non-technical audiences
Job Requirements
Current enrollment in a relevant post-secondary program
Over 1 year of related experience
Proficient with MS Office Suite and internet applications
Strong communications skills with positive personality and willingness to accept challenges
A strong analytical mind with attention to detail and desire to learn and grow
Assigned Line of Business Requirements
Currently enrolled in either a recognized undergraduate or graduate degree majoring in Computer Science, Physics, Mathematics, Statistics, Engineering, Science, Data Analytics or related, with the intent of going back to school at the start of your work term.
Strong statistical and analytical skills and interest are necessary.
Excellent verbal and written communication with the ability to work collaboratively and effectively in a team environment.
Experience in one or more of R, R Shiny, Python, SQL, SAS or other data-related programming languages.
Experience with Data Management, Analytics, and Project Management is a plus.
Experience and depth of knowledge in Spark, Hadoop, Machine Learning, Hive, Monte Carlo & Tableau would be considered an asset
Additional Information
Early Talent Requirements
Applications must include a transcript, cover letter (one letter-sized page or less) and a resume (maximum of 2 pages).
We welcome all applications; however, we will only contact qualified candidates chosen for an interview. Thank you for your interest.
TD requires employees to reside in the country where the role is located, irrespective of remote working arrangements
Inclusiveness
At TD, we are committed to fostering an inclusive, accessible environment, where all employees and customers feel valued, respected and supported. We are dedicated to building a workforce that reflects the diversity of our customers and communities in which we live and serve. If you require an accommodation for the recruitment/interview process (including alternate formats of materials, or accessible meeting rooms or other accommodation), please let us know and we will work with you to meet your needs.
Type of Role
Internship/Co-Op and Summer Opportunities
Start Date
Winter
Job Family
Campus
Job Category - Primary
Campus Program
Job Category(s)
Campus Program
Hours
37.5
Business Line
Corporate
Time Type
Full Time
Employment Type
Intern / Student
Country
Canada
**Province/State (Primary)
Ontario
City (Primary)
Toronto
Work Location
TD Centre - TD Tower - 66 Wellington Street West
Job Expires
26-Sep-2021"
18,Coursera,Software Engineer Intern (Winter 2022) - Toronto,"Coursera was launched in 2012 by two Stanford Computer Science professors, Andrew Ng and Daphne Koller, with a mission to provide universal access to world-class learning. It is now one of the largest online learning platforms in the world, with 87 million registered learners as of June 30, 2021. Coursera partners with over 200 leading university and industry partners to offer a broad catalog of content and credentials, including Guided Projects, courses, Specializations, certificates, and bachelor’s and master’s degrees. Institutions around the world use Coursera to upskill and reskill their employees, citizens, and students in many high-demand fields, including data science, technology, and business. Coursera became a B Corp in February 2021.

Coursera’s Engineering teams are responsible for maintaining a scalable and reliable platform. Engineering works to build interactive products for the worldwide learner community. As an engineer at Coursera, you will be empowered to build well-engineered products that shape new platform features and advance our technical infrastructure. You will be encouraged to build reliable, scalable, testable, and efficient systems.

This internship will run from January 3 to April 22. During the 16 weeks internship, you'll be embedded as a member of a small Engineering team and paired with a mentor on your team. You will have the guidance, environment, and the responsibility of deploying your projects to production. You will work on real projects, features, and updates that will affect millions of learners worldwide!

Check out life at Coursera on The Muse!
Basic Qualifications:
Currently pursuing a B.A./B.S. Degree or higher in Computer Science, or related technical field
Must be currently enrolled in a full time degree program and returning to the program after the completion of the internship
Preferred Qualifications:
Strong competencies in data structures, algorithms and software design
Demonstrated software engineer experience via an internship, work experience, school projects or coding competitions.
Self-motivated, smart, hands-on, relentlessly focused on impact, and able to operate under a great deal of independence

Coursera is an Equal Employment Opportunity Employer and considers all qualified applicants without regard to race, color, religion, sex, sexual orientation, gender identity, age, marital status, national origin, protected veteran status, disability, or any other legally protected class.

If you are an individual with a disability and require a reasonable accommodation to complete any part of the application process, please contact us at accommodations@coursera.org.

Please review our CCPA Applicant Notice here."
19,Red Hat Software,Software Engineering Internship,"Job summary:
The Red Hat Software Engineering team is looking for a highly motivated Software Engineering Intern who wants to gain direct experience with open source and Red Hat’s offerings to join us in Canada. In this role, you will work in an environment where diverse perspectives are invited, the best ideas are valued, and people feel empowered to contribute. Freedom and courage are two of our core values, which is why you’ll need to be comfortable taking risks and exploring the unknown. But being a Red Hatter isn't just about being brave, it's also about demonstrating commitment and sticking to it.
Primary job responsibilities:
Contribute to the projects within and related to the Red Hat Ceph Storage community as a full-stack developer
Learn and contribute to the development of new features (from backend to frontend components), including test and peer review processes
Perform manual testing of newly developed features
Learn and practice the development cycle from requirements gathering, scoping, and source code development and peer reviewing to testing and verification
Work with a globally-distributed team
Actively participate in related upstream communities, including daily stand-up and weekly review meetings
Keep up to date on the latest technologies and development methodologies

#LI-DNI

Required skills:
Bachelor’s degree (U.S. or foreign equivalent) in computer science, computer engineering, or a related field, or equivalent professional experience
1+ year(s) of experience with the Linux or UNIX OS, e.g., Fedora, CentOS, or Ubuntu
1+ year(s) of experience with software development in Python or AngularJS, or other JavaScript frameworks like React.js
Familiarity with provisioning, orchestration, configuration, and deployment using cloud tools like Red Hat Ansible Automation Platform, Docker, or Kubernetes
Familiarity with software engineering best practices and continuous integration (CI) infrastructure tools like Git and Jenkins
Familiarity with agile development concepts like scrum, kanban, or lean
Prior participation in open source software communities like those of Ansible, Docker, Ceph, or Kubernetes
Excellent written and verbal communication skills
Ability to work effectively in a fast-paced environment with global and multi-cultural teams
About Red Hat:
Red Hat is the world’s leading provider of enterprise open source software solutions, using a community-powered approach to deliver reliable and high-performing Linux, hybrid cloud, container, and Kubernetes technologies. Red Hat helps customers integrate new and existing IT applications, develop cloud-native applications, standardize on our industry-leading operating system, and automate, secure, and manage complex environments. Award-winning support, training, and consulting services make Red Hat a trusted adviser to the Fortune 500. As a strategic partner to cloud providers, system integrators, application vendors, customers, and open source communities, Red Hat can help organizations prepare for the digital future.

Red Hat is proud to be an equal opportunity workplace and an affirmative action employer. We review applications for employment without regard to their race, color, religion, sex, sexual orientation, gender identity, national origin, ancestry, citizenship, age, uniformed services, genetic information, physical or mental disability, medical condition, marital status, or any other basis prohibited by law.

Red Hat does not seek or accept unsolicited resumes or CVs from recruitment agencies. We are not responsible for, and will not pay, any fees, commissions, or any other payment related to unsolicited resumes or CVs except as required in a written contract between Red Hat and the recruitment agency or party requesting payment of a fee."
20,Coursera,"Software Engineer, Entry-Level (2022) - Toronto","Coursera was launched in 2012 by two Stanford Computer Science professors, Andrew Ng and Daphne Koller, with a mission to provide universal access to world-class learning. It is now one of the largest online learning platforms in the world, with 87 million registered learners as of June 30, 2021. Coursera partners with over 200 leading university and industry partners to offer a broad catalog of content and credentials, including Guided Projects, courses, Specializations, certificates, and bachelor’s and master’s degrees. Institutions around the world use Coursera to upskill and reskill their employees, citizens, and students in many high-demand fields, including data science, technology, and business. Coursera became a B Corp in February 2021.

As an engineer at Coursera, you will be empowered to build well-engineered products that shape new platform features and advance our technical infrastructure. You will be encouraged to build reliable, scalable, testable, and efficient systems.

We innovate, productize, and iterate at start-up speed, deploying our code over 25 times a day. When you join our team, you will be given the opportunity to take ownership of significant parts of our codebase. Check out life at Coursera on The Muse!
Some Cool Projects our Entry Level Software Engineers worked on:
VM-less Frontend Development, allowing frontend developers to develop JavaScript applications without installing the entire Coursera stack on our laptops
Scaling Content Production, building better tooling and visualization to simplify and accelerate the content creation process for our instructors
Rewriting the mobile download experience which boosted accessibility of downloads by creating a download widget on course outlines and wrote a downloads API to use throughout entire app
Building UI for a message inbox within the course experience, helping learners keep up-to-date with communications from course instructors and Coursera as they go through the course
Your Responsibilities
Rapidly innovate on products and scalable infrastructure with a fail fast mindset
Implement features using cutting edge technologies (i.e. React.js, Scala, Swift, Kotlin)
Work in a cross functional team of engineers, PMs, designers, and UX researchers
Own projects and drive scoping and prioritization decisions
Measure your work thoroughly, analyze results, and drive new product changes through A/B testing
Basic Qualifications:
Education in software engineering, computer science, or a related field; either as your major or minor in college, as part of a coding bootcamp, or via taking courses, including some of our own
Experience in software engineering or related internships or experience with software engineering/computer science projects

Preferred Qualifications:
Strong oral and written communication skills
Ability to work on a team and learn quickly
Coursera is an Equal Employment Opportunity Employer and considers all qualified applicants without regard to race, color, religion, sex, sexual orientation, gender identity, age, marital status, national origin, protected veteran status, disability, or any other legally protected class.

If you are an individual with a disability and require a reasonable accommodation to complete any part of the application process, please contact us at accommodations@coursera.org.

Please review our CCPA Applicant Notice here."
21,Amazon Dev Centre Canada ULC,Software Development Engineer,"1+ years of experience contributing to the architecture and design (architecture, design patterns, reliability and scaling) of new and current systems.
2+ years of non-internship professional software development experience
Programming experience with at least one modern language such as Java, C++, or C# including object-oriented design
. Bachelor’s Degree in Computer Science or related field
. 2 or more years' professional experience in software development
. Computer Science fundamentals in object-oriented design and data structures

*** Open to New York, or Toronto location ****

The Amazon Advertising engineering team has an opportunity to be part of something big! Working on advertising for Amazon.com, Kindle Special Offers, and Amazon Mobile Ads, the Ad Product Tools team provides critical tools that streamline ad delivery to millions of Amazon customers. CCS Engineering team is looking for a talented Software Development Engineer to help us build solutions to our platforms across web for custom applications.

A day in the life
A successful candidate will have an interest in developing automated solutions for consumer-facing products, strong technical ability, excellent organizational skills, great communication skills, and a motivation to achieve results in a fast-paced environment.

About the hiring group
Team Carbon (CCS) Engineering team is looking for SDE to be part Advertising engg team’s exciting journey to build from scratch the Advertising Campaign - Skill based Routing, Manager Dispatcher and Planning tools. we will be working on a complex problem space, be part of a fun, but competitive group of peers, leverage the core-engineering skills, and nurture the out of box thinking. While we are mindful of creating operational efficiencies to streamline the customer journey and reduce hurdles to launch campaigns, our vision is to empower Advertisers to create effective, high performing campaigns across all geographies and ad products

Job responsibilities
As a Software Development Engineer, you will be designing and developing automated solutions that help guarantee the software quality across a wide range of devices and web. You will be working on tools and infrastructure challenges involving big data and large scale back-end web services, all with the goal of delivering seamless experience to the customer.

Amazon is committed to a diverse and inclusive workplace. Amazon is an equal opportunity employer and does not discriminate on the basis of race, national origin, gender, gender identity, sexual orientation, disability, age, or other legally protected status. If you would like to request an accommodation, please notify your Recruiter.

. 2+ years of experience as a Software Development Engineer
Strong knowledge of software development methodology and tools, with demonstrated experience in software development engineering role
Strong, object-oriented design and coding skills
Coding experience with frameworks, tools, services, and physical devices.
Strong experience in Java Services (UI and backend), Database, and customer facing APIs
Ability to effectively articulate technical challenges and solutions
Deal well with ambiguous/undefined problems; ability to think abstractly
Experienced in Agile or Scrum software development methodologies
Experience influencing software engineering best practices within your team
Excellent communication, collaboration, reporting, analytical and problem solving skills"
