,company,job_header,job_description
30,Canadian Tire,"Analyst, Digital Product & Customer Analytics","Help us boldly shape retail in Canada
Canadian Tire Corporation’s (CTC) rich heritage of serving Canadians from coast-to-coast dates back to 1922. Our vision is to become the #1 retail brand in Canada by 2022 and we are focused on innovating and making important investments in our business, especially when it comes to our people. To reach our goal, we need the best talent to help us evolve and drive change across the business – and boldly help shape Canada’s retail industry. As we strive to be at the forefront of a complex and vastly changing retail industry, it is an exciting time to join the Canadian Tire family of companies.
Reporting to the Manager, Digital Strategy and Analytics, the Analyst, Digital Product and Customer Analytics is responsible for the digital data handling and management for CTC digital properties, oversees and builds out new digital reporting designs (KPIs, data, format, channels, processes, etc.), conducts in-depth analysis to support the Senior Executive team and digital teams across the organization. The position is fundamental in supporting the execution of digital strategy across the enterprise, as well as assisting in building the omni-channel view of the customer.
What you’ll do
Digital data handling and management for main digital properties -CanadianTire.ca, SportChek.ca, Marks.com
Query, extract and transform raw data from multiple data warehouses to conduct key insight and in-depth analysis of customer, website and digital products (search, recommendations, login and checkout)
Oversee dashboards for digital product and customer insights teams to translate complex data into actionable insight
Approach problems with an entrepreneurial mindset
Work on ad-hoc projects that leverage multiple sources of data such as inventory, cost, web analytics, loyalty amongst several other data sources
Work with IT and business stakeholders to influence decision making with data
Who you are
We are looking for high performing individuals who are:
Have a grasp of statistics, one or multiple programming languages and basic understanding of databases
Can translate business requirements into technical specifications
Strong business acumen, including modelling and strategic business case development
Work with an ‘automate first’ mindset and continuously strives to work more efficiently
Collaborative, analytically savvy, strategically astute and capable of delivering in a fast paced and innovative market
Ability to communicate with people at all levels of the organization in a professional and competent manner
What you’ve done
Bachelor’s degree or equivalent combination of education and experience: degrees in disciplines such as Engineering, Science, Mathematics/Statistics, Computer Science are preferred
Internship in data domain or experience working with large datasets agnostic of any industry
Strong knowledge of SQL to perform complex data analysis is necessary, additional experience with Python or another language to transform and process data is needed.
Experience with web analytics tools such as Google Analytics, Adobe Analytics or Quantum Metric is preferred
Working knowledge in GCP Data technologies (Google Cloud, Big Query), experience with other cloud databases such as Snowflake is a plus
Experience with data intelligence/visualisation platforms such as Looker, Google Datastudio, Tableau or other similar tools is a plus
Canadian Tire is an equal opportunity employer. We are committed to a diverse and inclusive workplace for all. We recognize that our future success depends on the perspectives and contributions of all our employees - their diverse backgrounds, abilities and experiences make our business stronger. If you are contacted for a job opportunity, please advise us of any accommodations needed to ensure fair and equitable access throughout the recruitment and selection process. All accommodation information provided will be treated as confidential and used only for the purpose of providing an accessible candidate experience. Corp Strategy & Development
Ontario-Toronto
Permanent
Full-time
Job Posting
: Sep 10, 2021, 5:09:42 PM"
31,Scotiabank,VELOCITY - Data Scientist - Summer 2022,"Requisition ID: 120522

Cost Centre: [[costCenter]]

Employee Referral Program – Potential Reward:

We are committed to investing in our employees and helping you continue your career at Scotiabank.
VELOCITY – Data Scientist – Summer 2022

WORK TERM: 4 Months - Summer 2022 (May - August)
What Can I Expect from the Velocity Program?

This is not your average internship or co-op! This is a customized experience that focuses on providing you with the development and tools you need to grow your career. In Velocity you will gain exposure to both business and technology by having a customized plan for your next internship or co-op. Yes, you read that correctly. After successfully completing your first co-op or internship, we will work with you to establish a learning and mentorship plan which also outlines your future placements. As a result, you will get to learn, grow and experiment within different areas of both Scotiabank and Tangerine.
You will…
Collaborate with business lines and other stakeholders and identify opportunities to drive business value by leveraging data science solutions
Leverage distributed computing tools (e.g., Spark, Cloud) for analysis, data mining, and modeling
Collaborate with data engineering, software developer, and other analytics teams to build analytical dataset and model
Create and apply model and algorithm testing strategies to measure, conduct testing to measure the effectiveness of models, and make ongoing changes
Prepare detailed documentation to outline data sources, models, and algorithms used and developed
Present results to business line stakeholders and help implement real data-driven changes
Work on challenging and research-based initiatives using advanced machine learning methods focusing on data-driven outcomes
Experiment & learn!
You Are?
You are an undergraduate student that gets excited by continuous integration and deployment. You have a passion for innovation and spend your free time problem solving and tinkering with new technologies. You thrive in a fast paced ever changing environment and need to be a part of something BIG. You love to learn and envision yourself working for an international organization that heavily invests in your future.
Throughout your undergrad, you have acquired basic knowledge in the software development life cycle, object-oriented programming, and database programming. You consider yourself an influencer that can translate business objectives into technical priorities. You are logical, and familiar with various development tools. You love being involved in extracurricular activities such as hackathons or tech conferences. You are not afraid to roll up your sleeves and get things done!
You have basic knowledge in…
Computer Science, Electrical/Computer/Software Engineering, or Mathematics
Cleaning, transforming, and visualizing large data sets working with various data formats (e.g. unstructured logs, XML, JSON, flat files)
Big Data/Cloud ecosystem (e.g. GCP)
Experimental design, statistical analysis, machine learning
Python programming
Common machine learning libraries in Python, PySpark (scikit-learn, xgboost)
UNIX tools and shell scripting
SQL skills for querying relational databases (e.g., SQL Server, DB2, MySQL)
Visualization tools like PowerBI
Kubernetes
Git Workflows (Pull Request, Code Review, Branching)
How to apply?
For students, we believe evaluating you through relationships over resumes, and we are focused on learning about who you are and what you’re interested in to uncover your true potential. In short, we don’t believe resumes will provide us with an accurate depiction of what you’re truly about in order to properly assess your potential. Instead, we want to get to know YOU and hear about your experiences that have shaped you. We know… this might sound crazy but we do not want you to submit your resume. Instead, we ask that as part of your application, you complete the steps below:
1) Complete your PLUM Profile here
2) Take a screenshot of your completed PLUM profile.
3) Complete a very short one-way video interview by clicking here
4) When it prompts you to submit your resume, do not attach your resume! Instead, attach the screenshot of your PLUM profile under the ""resume"" section (step #2 above). Cover letters are optional – not required.
We welcome all applications, but can only respond to candidates selected for an interview. Scotiabank and Tangerine are committed to providing an inclusive and accessible candidate experience. Only those candidates selected for an interview will be contacted. If you require accommodation during the recruitment and selection process, please let us know. We will work with you to meet your needs.
Location(s): Canada : Ontario : Toronto

Scotiabank is a leading bank in the Americas. Guided by our purpose: ""for every future"", we help our customers, their families and their communities achieve success through a broad range of advice, products and services, including personal and commercial banking, wealth management and private banking, corporate and investment banking, and capital markets.

At Scotiabank, we value the unique skills and experiences each individual brings to the Bank, and are committed to creating and maintaining an inclusive and accessible environment for everyone. If you require accommodation (including, but not limited to, an accessible interview site, alternate format documents, ASL Interpreter, or Assistive Technology) during the recruitment and selection process, please let our Recruitment team know. If you require technical assistance, please click here. Candidates must apply directly online to be considered for this role. We thank all applicants for their interest in a career at Scotiabank; however, only those candidates who are selected for an interview will be contacted."
32,TD Bank,Portfolio Analytics Developer Intern/Co-op,"All companies are not the same. What makes TD special as a business is also, what makes us special as an employer. Why TD?

TD's Colleague Promise: A better you. A better us.

A more confident you means a stronger us. We empower you to grow your skills, gain new perspectives, and create impact at work and in your community. That’s our unique and inclusive culture.
Department Overview
Co-op and Internship opportunities allow you to gain valuable work experience across a number of the businesses at TD. You will work with experienced colleagues, receive world class training, and be part of a community of students across TD, where you will have an impact, grow as individual and experience our culture of care.

Our Momentum Program is offered with select Co-op and Internship roles and is designed to help you better understand the TD business, build on critical career capabilities, and broaden your professional network. This program is designed to complement your on-the job experience and features:
Leadership talks with key Leaders from across the organization
Lunch and Learns on topics such as Innovation
Diversity and Inclusion and Personal Branding and so much more

TD Asset Management Inc. (TDAM) is an Investment Management firm with leading market positions in active, quantitative and passive portfolio management serving a large and diversified client base including pension funds, corporations, institutions, endowments, foundations and high net worth individuals. We also offer private money management services and manage retail mutual funds
Job Description
We are seeking a Full Stack Developer to join us in the Portfolio Research & Analytics team to build cutting-edge portfolio management applications using technologies such as Python, JavaScript – especially React & Redux frameworks, and SQL.
The web applications developed by the Portfolio Research & Analytics team are directly used in the daily management and monitoring of hundreds of billions of dollars in assets.
Why you should be excited about applying for this role:
A chance to see the results of your work have immediate real-world impact
One-on-one mentoring
Co-op events
Students will have the opportunity to work on several projects independently and see their code used in production. Students will gain extensive web and/or backend development experience, exposure to single page application architecture; Python programming experience at the application layer; and significant hands-on SQL database experience.
Job Requirements
Currently enrolled in an undergraduate degree majoring in relevant technology programs, such as Computer Science, Engineering, Mathematics, or similar
Must be enrolled in an undergraduate degree with the intent of going back to school at the start of your work term
Strong software development skills, the ability to learn new technologies and business concepts quickly are essential for success at this position. Previous experience with the following technologies will be preferred:
JavaScript (especially React and Redux frameworks)
REST API's, MVC frameworks
Python
SQL and database design (with any major RDBMS).
GIT version control
Familiarity with software development in a Linux-based environment.
We will consider candidates with strong technical backgrounds that do not necessarily have direct experience with the specific technologies used on our team.
Attributes that are beneficial to the role are: self-starter, analytical and attention to detail.
The ideal candidate should be comfortable working in a team environment.
Some coursework or interest in finance will be considered an asset.
Additional Information
This position is a 4-month work term and will commence January 4th – April 29th, 2022.
Applications must include a transcript, cover letter (one letter-sized page or less) and a resume (maximum of 2 pages).
We welcome all applications; however, we will only contact qualified candidates chosen for an interview. Thank you for your interest.
TD requires employees to reside in the country where the role is located, irrespective of remote working arrangements
TD is committed to providing you with the best candidate experience and internship in these unique circumstances. As such, work location and start dates are subject to change.
Inclusiveness
At TD, we are committed to fostering an inclusive, accessible environment, where all employees and customers feel valued, respected and supported. We are dedicated to building a workforce that reflects the diversity of our customers and communities in which we live and serve. If you require an accommodation for the recruitment/interview process (including alternate formats of materials, or accessible meeting rooms or other accommodation), please let us know and we will work with you to meet your needs.
Type of Role
Internship/Co-Op and Summer Opportunities
Start Date
Winter
Job Family
Campus
Job Category - Primary
Campus Program
Job Category(s)
Campus Program
Hours
37.5
Hours/Availability Detail
Monday-Friday, standard business hours
Business Line
Corporate
Time Type
Full Time
Employment Type
Intern / Student
Country
Canada
**Province/State (Primary)
Ontario
City (Primary)
Toronto
Work Location
TD Centre - TD Tower - 66 Wellington Street West
Job Expires
26-Sep-2021"
33,Salesforce,AMTS Software Engineer,"To get the best candidate experience, please consider applying for a maximum of 3 roles within 12 months to ensure you are not duplicating efforts.
About Futureforce University Recruiting
Our Futureforce University Recruiting program is dedicated to attracting, retaining and cultivating talent. Our interns and new graduates work on real projects that affect how our business runs, giving them the opportunity to make a tangible impact on the future of our company. With offices all over the world, our recruits have the chance to collaborate and connect with fellow employees on a global scale. We offer job shadowing, mentorship programs, talent development courses, and much more.
Job Category
Products and Technology
Job Details
Job Details
Want your line of code to have a significant and measurable positive impact for users, the company’s bottom line, and industry? Join Salesforce and define the future of cloud computing. We deliver a scalable, high performance cloud computing platform that delights our customers, and is used by millions of people around the world each day for their business. You will be working with a group of world-class engineers to build breakthrough features that our customers will love, adopt and use while keeping our trusted platform stable and scalable. The software engineer role at Salesforce encompasses architecture, design, implementation, and testing to ensure we build products right and release them with high quality.

We are looking for the best and brightest new college graduates to join our team of world class, highly motivated software engineers and cloud computing experts. You will have a chance to be mentored and network with senior levels at Salesforce, and be a part of a year long new graduate program with various targeted events throughout the year.

From Marketing Cloud to Service Cloud, Platform to IoT, Einstein Platform, Security and everything in between we have many opportunities available across various applications and platforms. Apply now and we look forward to reaching out to you with opportunities that fit your background and interests!

Key Responsibilities:
Architect, design, implement, test and deliver highly scalable products
Master our development process, culture and code base, then improve it
Work closely with a team of engineers, product managers, user experience experts and performance engineers to build new features our customers will love, adopt and use while keeping our trusted platform stable and scalable
Develop test strategies, design automation frameworks, write unit/functional tests to drive up code coverage and automation metrics
Analyze, design and develop test cases and implement automated test suites

Required Skills:
BS or MS in Computer Science or related technical field
Academic, professional or internship experience working in a professional coding setting environment
Fluency in object-oriented programming/design
Academic, professional or internship experience in one of Java, Python, Javascript, HTML, SQL or C++

Desired Skills:
Strong analytical and problem-solving skills
Team-player with the ability to work effectively and efficiently with others
Be a self-starter and possess strong sense of self-motivation
Experience using telemetry and metrics to drive operational excellenc
For Colorado-based roles: Minimum annual salary of $110,000. You may also be offered a bonus, restricted stock units, and benefits. More details about our company benefits can be found at the following link: https://www.getsalesforcebenefits.com/
About Futureforce University Recruiting
Our Futureforce University Recruiting program is dedicated to attracting, retaining and cultivating talent. Our interns and new graduates work on real projects that affect how our business runs, giving them the opportunity to make a tangible impact on the future of our company.



With offices all over the world, our recruits have the chance to collaborate and connect with fellow employees on a global scale. We offer job shadowing, mentorship programs, talent development courses, and much more.
Accommodations
If you require assistance due to a disability applying for open positions please submit a request via this Accommodations Request Form .
Posting Statement
At Salesforce we believe that the business of business is to improve the state of our world. Each of us has a responsibility to drive Equality in our communities and workplaces. We are committed to creating a workforce that reflects society through inclusive programs and initiatives such as equal pay, employee resource groups, inclusive benefits, and more. Learn more about Equality at Salesforce and explore our benefits.
Salesforce.com and Salesforce.org are Equal Employment Opportunity and Affirmative Action Employers. Qualified applicants will receive consideration for employment without regard to race, color, religion, sex, sexual orientation, gender perception or identity, national origin, age, marital status, protected veteran status, or disability status. Salesforce.com and Salesforce.org do not accept unsolicited headhunter and agency resumes. Salesforce.com and Salesforce.org will not pay any third-party agency or company that does not have a signed agreement with Salesforce.com or Salesforce.org .
Salesforce welcomes all."
34,TD Bank,Data Management & Reporting Intern/Co-op,"All companies are not the same. What makes TD special as a business is also, what makes us special as an employer. Why TD?

TD's Colleague Promise: A better you. A better us.

A more confident you means a stronger us. We empower you to grow your skills, gain new perspectives, and create impact at work and in your community. That’s our unique and inclusive culture.
Department Overview
Co-op and Internship opportunities allow you to gain valuable work experience across a number of the businesses at TD. You will work with experienced colleagues, receive world class training, and be part of a community of students across TD, where you will have an impact, grow as individual and experience our culture of care.
Our Momentum Program, is offered with select Co-op and Internship roles, and is designed to help you better understand the TD business, build on critical career capabilities, and broaden your professional network. This program is designed to complement your on-the job experience and features:
Leadership talks with key Leaders from across the organization
Lunch and Learns on topics such as Innovation
Diversity and Inclusion and Personal Branding and so much more
Job Description
The Data Management and Reporting Co-op/Intern is a a 4-month work term opportunity in analytics and data. The Data Management and Reporting Co-op/Intern will perform a variety of activities, which may include:
Supporting data pipelines to support analytics solutions through system and data integration, and structuring
Support data management activities, including data quality, metadata, and data life cycle management in alignment with enterprise policies
Collaborate with technology partners to support data ingestion activities to enable the use of enterprise tools for analytics and data science
Conduct SQL queries and develop reporting to inform business decisions
Job Requirements
Current enrollment in a relevant post-secondary program
Over 1 year of related experience
Proficient with MS Office Suite and internet applications
Strong communications skills with positive personality and willingness to accept challenges
A strong analytical mind with attention to detail and desire to learn and grow
Assigned Line of Business Requirements
Currently enrolled in either a recognized undergraduate degree majoring in Computer Science, Mathematics, Engineering, Science, Statistics, Business, Data Analytics or related, with the intent of going back to school at the start of your work term.
Strong statistical and analytical skills and interest are necessary.
Strong proficiency with Excel.
Excellent verbal and written communication with the ability to work collaboratively and effectively in a team environment.
Knowledge in one or more of R, Python, SQL, SAS or other data-related programming languages.
Knowledge in Tableau.
Knowledge with Data Management, Analytics, and Project Management is a plus.
Knowledge of data quality, business glossaries, and data dictionaries are considered an asset.
Please note that the line of business that you are assigned to may require specific skills not mentioned in this posting.
Additional Information
Early Talent Requirements
Applications must include a transcript, cover letter (one letter-sized page or less) and a resume (maximum of 2 pages).
We welcome all applications; however, we will only contact qualified candidates chosen for an interview. Thank you for your interest.
TD requires employees to reside in the country where the role is located, irrespective of remote working arrangements
TD is committed to providing you with the best candidate experience and internship in these unique circumstances. As such, work location and start dates are subject to change.
Inclusiveness
At TD, we are committed to fostering an inclusive, accessible environment, where all employees and customers feel valued, respected and supported. We are dedicated to building a workforce that reflects the diversity of our customers and communities in which we live and serve. If you require an accommodation for the recruitment/interview process (including alternate formats of materials, or accessible meeting rooms or other accommodation), please let us know and we will work with you to meet your needs.
Type of Role
Internship/Co-Op and Summer Opportunities
Start Date
Winter
Job Family
Campus
Job Category - Primary
Campus Program
Job Category(s)
Campus Program
Hours
37.5
Business Line
Corporate
Time Type
Full Time
Employment Type
Intern / Student
Country
Canada
**Province/State (Primary)
Ontario
City (Primary)
Toronto
Work Location
TD Centre - TD Tower - 66 Wellington Street West
Job Expires
26-Sep-2021"
