,company,job_header,job_description
44,AltaML,Associate Product Manager - Internship,"Please note: This opportunity is for current students open for work experience for January 2022.

As the Associate Product Manager, you are responsible for assisting in building useful products customers love for AlphaLayer.

Confidence can sometimes hold us back from applying for a job. We’ll let you in on a secret - there is no such thing as a perfect candidate. AlphaLayer is working with new technologies, and no one is standing still when it comes to learning. As long as you are continuing to push your growth and development, then consider applying even if you don’t check all the boxes on our posting.
What you'll do:
Research product trends to keep up to date with the rapidly evolving world of technology in the investment management industry
Identifying where machine learning may be uniquely capable of solving those needs
Quantifying the opportunity by estimating the value to the customer and the market
Formulating a product vision
Translating your vision into a product roadmap
Breaking down the roadmap into releases that deliver incremental value
Write requirements and user stories, create simple wireframes, prototypes, and develop test, release, and feedback plans
Work collaboratively with our machine learning, software development, and UI teams to ensure clear communication of objectives, prioritization, iteration, and successful delivery
Formulate and execute a go to market strategy
Monitor where your strategy is failing as it is exposed to the market and determine the right pivots to improve growth and profitability
What you bring:
Progress towards completing a Bachelor’s degree in Computer Science or Business or related field
Understanding of financial markets and investment management is an asset
Confident, clear, and concise communication
Professional interaction with customers, including executives
Experience with the full life cycle of a product, from conception to revenue
Experience with machine learning is a plus
Knowledge of additional functional areas such as Engineering, Sales, UX/UI, Customer Support, Marketing, or Finance is a bonus
First Nations Acknowledgment
As this role is an opportunity in Toronto, Ontario - AlphaLayer acknowledges that we are on the traditional territory of many nations including the Mississaugas of the Credit, the Anishnabeg, the Chippewa, the Haudenosaunee and the Wendat peoples and is now home to many diverse First Nations, Inuit and Métis peoples. AlphaLayer also acknowledges that Toronto is covered by Treaty 13 signed with the Mississaugas of the Credit, and the Williams Treaties signed with multiple Mississaugas and Chippewa bands.

Equal Opportunities
AlphaLayer is an equal opportunity employer committed to creating a safe, diverse and inclusive environment. We encourage qualified applicants of all backgrounds including ethnicity, religion, disability status, gender identity, sexual orientation, family status, age, nationality, and education levels to apply. If you are contacted for an interview and require accommodation during the interviewing process, please let us know.

About our Company:
Our work through AlphaLayer has a strong emphasis on deepening our partnership with Alberta Investment Management Corporation (AIMCo). Our goal is to provide a competitive advantage for our clients by combining AIMCo’s data and domain expertise with AlphaLayer’s ML and software expertise.
AlphaLayer’s mission is to create better investment outcomes for the stakeholders of our clients by building cutting-edge solutions that help us understand and adapt to the evolving financial markets. We do this by building AI technologies to enable quicker, more robust investment decision making.

Data informs our every move, and we aim to work quickly, collaboratively, and creatively.

Who we are looking for:
Our core values speak volumes about who we are and how we work:

Humble – Listen to the data
Happy – Tap-dance to work
Gritty – Be persistent, not complacent
Agile – Make small bets, then iterate

What we have to offer you:
You will be able to experience a collaborative company culture. We nurture an environment that combines the nimbleness and can-do attitude of a successful start-up, but with the scale of a large investment management firm.

Your work will be applied to real-world problems and will have a high impact on our clients and Alberta’s economy. You will be working with extremely talented and passionate people who bring multiple years of industrial and academic experience in data science, software engineering, and machine learning fields. To solve the problems we apply various ML techniques from traditional Machine Learning and Data Mining algorithms, through to vision, Deep Learning, Information Extraction, advanced NLP and conversational agents.

We also have fun. We believe in working hard, getting the job done and enjoying the group social Fridays. You’ll also get flexibility in where you work, what hours you work, how much vacation you take, and what you wear. We expect hard work but respect work/life balance.

Confidence can sometimes hold us back from applying for a job. We’ll let you in on a secret - there is no such thing as a perfect candidate. AlphaLayer is working with new technologies, and no one is standing still when it comes to learning. As long as you are continuing to push your growth and development, then consider applying even if you don’t check all the boxes on our posting.
So, however you identify and whatever background and experiences you bring, please apply if this is a role that would make you “tap dance to work” every day. We would love to add your biological uniqueness to our own! :-)
Note:
You will be required to undergo the following checks during the hiring process:
Background
Education
Criminal
Credit
References"
45,HomeX,Machine Learning Co-op (Winter),"HomeX is an end-to-end technology and services platform for both homeowners and service providers, radically improving the historically complex and fragmented home services industry.

Our technology team includes a dedicated Applied Science group, where world-leading natural language and knowledge engineers, use these skills to solve customer problems and build the HomeX consumer experience.

As an intern in the HomeX Applied Science group, you’ll have the opportunity to work on an independent project. You’ll have assistance from our group at every turn, but you will be able to apply your research and engineering knowledge to solve a complex real-world problem. You’ll create data-driven solutions that allow homeowners and technicians to solve problems in the home quickly and efficiently. You’ll write code to train, test, deploy and evaluate ML models, using Python (numpy, pandas, Tensorflow) in one of the following areas: NLU, machine perception, machine reasoning, knowledge engineering, and ontology.

About You
You’re a naturally curious problem solver. You love technology, but you always have an eye on solving problems for your customers. When faced with a challenge, you enjoy diving in, learning from experience, and applying what you learned to improve. You keep an open mind and actively seek out new information, whether it’s the latest research in a field you’re passionate about, or recent developments in technologies, and adapt your approach as you go to solve the problem at hand. You’re able to make progress by yourself, but you’re unafraid to ask for help when you need it. You diligently apply your high standards in everything you do, and you hold others to those same high standards.
Job Responsibilities:
Ownership over your project with support from your teammates and mentor
Work closely with other team members to develop features and improve our codebase
Discuss, help, plan and prepare features to be worked on with the team
Deliver high quality and well tested code
Components of HomeX Internship Program:
Can tackle an ownable, real-world project and present key findings to the HomeX team
Participate in team meetings - share ideas and help brainstorm solutions
Participate in regular employee orientation, with introductions to each of our business units and key functions
Weekly meetups with deep dives into the inner workings of specific projects and teams, from sales operations to content strategy and more
Fireside chats with the CEO and the President
Dedicated mentorship from a senior team member, in addition to your direct manager
End-of-term capstone presentation, where you get to show off your project to folks across the company
Inclusion in all HomeX employee events, including (virtual) socials and monthly All Hands presentations
Required Skills:
Ideally majoring in Computer Science, Computer Engineering, Mathematics or a similar STEM based major
Interest and/or experience in natural language understanding and machine learning
Familiarity or interest to learn about some of the most innovative technologies, in the languages we work in (ex. TypeScript, Node, Python)
Strong attention to detail
You are proactive in finding solutions to problems
You can collaborate and communicate strongly
You want to make a difference and have an impact
About HomeX
Do you want to reinvent a trillion-dollar industry? HomeX is a radically better home services platform combining world-class technology and next generation service operations. We are reshaping the experience for both consumers and businesses in the trillion-dollar home services industry.

Being radically better requires new end-to-end solutions for both consumers and technicians. This is why HomeX is combining a technology platform for the entire industry, a managed service network, and full-service experiences for consumers. Creating this integrated ecosystem enables us to deliver uniquely simple and personalized solutions that are redefining home services.

HomeX has experienced exponential growth because of our commitment to evolve the industry, our determination to be a positive force, and our passion for groundbreaking technology. Joining HomeX now is a once in a lifetime career opportunity for anyone passionate about making a difference and making history in consumer technology.

Check out our recent press, including TechCrunch's coverage of our $90M raise, here.

Why work with us? Working at HomeX means collaborating with experienced, people-first leaders with a clear vision and a track record of success, as well as the close-knit camaraderie of a team of highly talented and motivated coworkers. We offer a collaborative, positive working environment where we encourage employees to balance productivity with the need to recharge the batteries. And of course, you get paid pretty well - we offer competitive compensation packages, including equity, performance-based incentives and competitive benefits for full time employees.

Note: All HomeX offices are currently closed due to the coronavirus pandemic. As of June 2021, we plan to reopen offices mid summer, pending local regulations, and will expect most employees to work onsite 2-3 days per week by the end of the year.

HomeX values diversity in the workplace and is an equal opportunity employer. We are committed to providing an inclusive and accessible work environment. We thank all candidates who apply, but only those selected for an interview will be contacted. If you require accommodation, please let us know. We will work with you to meet your needs"
46,Scotiabank,VELOCITY - Data & Business Analysis - Winter 2022 1 1,"Requisition ID: 119261

Join a purpose driven winning team, committed to results, in an inclusive and high-performing culture.
VELOCITY – Data Engineer – 8 Months

WORK TERM: 4 Months - Winter 2022 - Summer 2022 (January - August)
What Can I Expect from the Velocity Program?

This is not your average internship or co-op! This is a customized experience that focuses on providing you with the development and tools you need to grow your career. In Velocity you will gain exposure to both business and technology by having a customized plan for your next internship or co-op. Yes, you read that correctly. After successfully completing your first co-op or internship, we will work with you to establish a learning and mentorship plan which also outlines your future placements. As a result, you will get to learn, grow and experiment within different areas of both Scotiabank and Tangerine.
You will…
Perform data exploration on different data sources and model training
Productionalize/Operationalize advanced analytics models following the Bank standards. ModelOps plays a key role as a liaison with other teams (Security, Privacy, Data Office, Analytics Technology, among others)
Automate data pipelines and trigger actions/events to streamline business processes and models enablement
Enable mechanisms for Data Scientist and stakeholders to monitor the performance of a Model
Monitor the run time of the models, work closely with Data Scientist on continuous optimization
Monitor data pipelines, liaise with vendors and source systems groups in the event of failures/maintenance
Migrate data pipelines and models to new analytics platforms
Experiment & learn!
You Are?
You are an undergraduate student that gets excited by continuous integration and deployment. You have a passion for innovation and spend your free time problem solving and tinkering with new technologies. You thrive in a fast paced ever changing environment and need to be a part of something BIG. You love to learn and envision yourself working for an international organization that heavily invests in your future.
Throughout your undergrad, you have acquired basic knowledge in the software development life cycle, object-oriented programming, and database programming. You consider yourself an influencer that can translate business objectives into technical priorities. You are logical, and familiar with various development tools. You love being involved in extracurricular activities such as hackathons or tech conferences. You are not afraid to roll up your sleeves and get things done!
You have basic knowledge in…
Business, Computer Science, Electrical/Computer/Software Engineering, or Mathematics
Some of the following technologies:
Big Data Technologies (Hive/Beeline, HDFS, Sqoop, Spark)
Cloud platforms – GCP, Azure or AWS
MinIO Data Storage, Airflow, Trino
DB2, SQL Server
Python (PyHive, PySpark), R, SQL-Shell (Bash, Korn) & general Linux/Unix
CI/CD tech stack (BitBucket, Jenkins, Artifactory)
How to apply?
For students, we believe evaluating you through relationships over resumes, and we are focused on learning about who you are and what you’re interested in to uncover your true potential. In short, we don’t believe resumes will provide us with an accurate depiction of what you’re truly about in order to properly assess your potential. Instead, we want to get to know YOU and hear about your experiences that have shaped you. We know… this might sound crazy but we do not want you to submit your resume. Instead, we ask that as part of your application, you complete the steps below:
1) Complete your PLUM Profile here
2) Take a screenshot of your completed PLUM profile.
3) Complete a very short one-way video interview by clicking here
4) When it prompts you to submit your resume, do not attach your resume! Instead, attach the screenshot of your PLUM profile under the ""resume"" section (step #2 above). Cover letters are optional – not required.
We welcome all applications, but can only respond to candidates selected for an interview. Scotiabank and Tangerine are committed to providing an inclusive and accessible candidate experience. Only those candidates selected for an interview will be contacted. If you require accommodation during the recruitment and selection process, please let us know. We will work with you to meet your needs.
Location(s): Canada : Ontario : Toronto

Scotiabank is a leading bank in the Americas. Guided by our purpose: ""for every future"", we help our customers, their families and their communities achieve success through a broad range of advice, products and services, including personal and commercial banking, wealth management and private banking, corporate and investment banking, and capital markets.

At Scotiabank, we value the unique skills and experiences each individual brings to the Bank, and are committed to creating and maintaining an inclusive and accessible environment for everyone. If you require accommodation (including, but not limited to, an accessible interview site, alternate format documents, ASL Interpreter, or Assistive Technology) during the recruitment and selection process, please let our Recruitment team know. If you require technical assistance, please click here. Candidates must apply directly online to be considered for this role. We thank all applicants for their interest in a career at Scotiabank; however, only those candidates who are selected for an interview will be contacted."
47,AltaML,Junior Marketing Associate - Internship,"Please note: This opportunity is for current students open for work experience for January 2022.

As the Junior Marketing Associate, you will learn and work alongside high-performing and creative professionals and play a crucial role on AlphaLayer’s Product team. You will work closely with the Head of Product on content creation and publishing, event management, social media, digital marketing, and market research. You will be given the resources and mentorship to help your growth and understanding of AI and ML concepts. If you have a passion for new-age marketing concepts and are willing to learn about the exciting world of artificial intelligence in the investment management industry, we would love to meet you.
What you'll do:
Work with the Head of Product on planned weekly/monthly/quarterly marketing activities
Suggest ideas for improved social media presence and engagement and help in implementation
Write content for articles and case studies as per best industry standards
Research the related industries and market to give recommendations to build brand awareness
Create content for automated emailers, learn to extract reports, and optimize
Assist in virtual and potentially in-person event planning and coordination
Create and manage reports/dashboards to measure brand awareness, and lead-gen campaigns
Most importantly, learn, create impact, experience a great culture, and have fun
What you bring:
An education in progress in a discipline related to marketing.
The position requires self-direction, strong interpersonal skills, and knowledge of basic marketing fundamentals
Understanding of financial markets and investment management is an asset
Understanding of technological concepts related to software development and computer systems
Knowledge of AI and ML concepts is a plus
Academic knowledge of B2B sales and marketing is a plus
Exceptional writing skills will be considered an asset
Highly effective communication and interpersonal skills
Cultural competency with a variety of people in diverse settings
Has an interest in technology and innovations
Ability to maintain the confidentiality of sensitive information
First Nations Acknowledgment
As this role is an opportunity in Toronto, Ontario - AlphaLayer acknowledges that we are on the traditional territory of many nations including the Mississaugas of the Credit, the Anishnabeg, the Chippewa, the Haudenosaunee and the Wendat peoples and is now home to many diverse First Nations, Inuit and Métis peoples. AlphaLayer also acknowledges that Toronto is covered by Treaty 13 signed with the Mississaugas of the Credit, and the Williams Treaties signed with multiple Mississaugas and Chippewa bands.

Equal Opportunities
AlphaLayer is an equal opportunity employer committed to creating a safe, diverse and inclusive environment. We encourage qualified applicants of all backgrounds including ethnicity, religion, disability status, gender identity, sexual orientation, family status, age, nationality, and education levels to apply. If you are contacted for an interview and require accommodation during the interviewing process, please let us know.

About our Company:
Our work through AlphaLayer has a strong emphasis on deepening our partnership with Alberta Investment Management Corporation (AIMCo). Our goal is to provide a competitive advantage for our clients by combining AIMCo’s data and domain expertise with AlphaLayer’s ML and software expertise.
AlphaLayer’s mission is to create better investment outcomes for the stakeholders of our clients by building cutting-edge solutions that help us understand and adapt to the evolving financial markets. We do this by building AI technologies to enable quicker, more robust investment decision making.

Data informs our every move, and we aim to work quickly, collaboratively, and creatively.

Who we are looking for:
Our core values speak volumes about who we are and how we work:

Humble – Listen to the data
Happy – Tap-dance to work
Gritty – Be persistent, not complacent
Agile – Make small bets, then iterate

What we have to offer you:
You will be able to experience a collaborative company culture. We nurture an environment that combines the nimbleness and can-do attitude of a successful start-up, but with the scale of a large investment management firm.

Your work will be applied to real-world problems and will have a high impact on our clients and Alberta’s economy. You will be working with extremely talented and passionate people who bring multiple years of industrial and academic experience in data science, software engineering, and machine learning fields. To solve the problems we apply various ML techniques from traditional Machine Learning and Data Mining algorithms, through to vision, Deep Learning, Information Extraction, advanced NLP and conversational agents.

We also have fun. We believe in working hard, getting the job done and enjoying the group social Fridays. You’ll also get flexibility in where you work, what hours you work, how much vacation you take, and what you wear. We expect hard work but respect work/life balance.

Confidence can sometimes hold us back from applying for a job. We’ll let you in on a secret - there is no such thing as a perfect candidate. AlphaLayer is working with new technologies, and no one is standing still when it comes to learning. As long as you are continuing to push your growth and development, then consider applying even if you don’t check all the boxes on our posting.
So, however you identify and whatever background and experiences you bring, please apply if this is a role that would make you “tap dance to work” every day. We would love to add your biological uniqueness to our own! :-)
Note:
You will be required to undergo the following checks during the hiring process:
Background
Education
Criminal
Credit
References"
